<!ELEMENT featurespace (feature)+>
<!ELEMENT feature (reg|list)+>
<!ELEMENT reg EMPTY>
<!ELEMENT list EMPTY>

<!ATTLIST featurespace
        name CDATA "default"
        version CDATA "default">

<!ATTLIST feature
        id CDATA #REQUIRED
        name CDATA #REQUIRED
        description CDATA "n/a"
        policy (sum|max|min|avg|prod|div) "sum">


<!ATTLIST reg
        sel (text|html|tag|title|keyword|description|url) "text"
        weight CDATA "1"
        exp CDATA #REQUIRED
        policy (count|exist) "count">

<!ATTLIST list
        sel (text|html|tag|title|keyword|description|url) "text"
        weight CDATA "1"
        src CDATA #REQUIRED
        policy (sum|max|min|avg|prod|div) "sum">

